{"$schema":"https://json-schema.org/draft/2020-12/schema","$id":"https://fs-gg.github.io/schemas/evidence/milestone-qualifications/v1","category":"milestone-qualifications","type":"object","required":["schema","policyVersion","parent","mode","boundaryKind","expectedChildren","children"],"properties":{"schema":{"const":"fsgg.coordination.milestone-qualification/1"},"policyVersion":{"type":"string","minLength":1},"parent":{"type":"string","minLength":1},"mode":{"enum":["scoped","comprehensive"]},"boundaryKind":{"type":["string","null"]},"expectedChildren":{"type":"array","minItems":1,"uniqueItems":true,"items":{"type":"string","minLength":1}},"children":{"type":"array","items":{"type":"object","required":["id","contractSha256","acceptance"],"properties":{"id":{"type":"string","minLength":1},"contractSha256":{"$ref":"#/$defs/sha256"},"acceptance":{"oneOf":[{"type":"null"},{"type":"object","required":["receiptPath","receiptDigest"],"properties":{"receiptPath":{"type":"string","minLength":1},"receiptDigest":{"$ref":"#/$defs/sha256"}},"additionalProperties":false}]}},"additionalProperties":false}}},"additionalProperties":false,"$defs":{"sha256":{"type":"string","pattern":"^[0-9a-f]{64}$"}}}
